tweet_id,author_id,tweet_by,tweet_by_verified,user_location,text,clean_tweet,adjectives,sentiment_text,created_at,source,retweets,replies,likes,quote_count,hastags,mentions,subjectivity,polarity,sentiment
1504567695475240976,1504455741553274881,panodds,False,Ireland  ☘ ,"@Perko78 @cricketcomau IPL is the wah forward buddy accept it or hate it, players need to take care of their future you cannot have international series during ipl if this happens then players will obviously go to ipl.Ipl is 4th biggest tournament in world after NBA NFL Laliga premier league okay",wah forward buddy accept hate need take care future international series obviously go th biggest tournament world premier league,buddy future international th tournament,wah forward buddy accept hate need take care future international series obviously go th biggest tournament world premier league,2022-03-17 21:17:46+00:00,Twitter for Android,0,2,2,0,[],"['Perko78', 'cricketcomau']",0.38125,-0.2,Negative
1504567634054070273,1175069258923069442,bets_pls,False,World,Dishonesty will stop people from saying the obvious truth that IPL is destroying the beautiful game of cricket that we all love. https://t.co/umGvMeEYO4,stop people saying obvious truth beautiful game cricket love,stop obvious beautiful,stop people saying obvious truth beautiful game cricket love,2022-03-17 21:17:32+00:00,Twitter for Android,0,0,2,0,[],[],0.625,0.2375,Positive
1504567548226019333,2382750613,rcb_itcell,False,,Thinking about selling your home? Get your seller guide today and learn about the process of home selling! https://t.co/9vAeV8eF59 https://t.co/Z0cNnIw8A7,thinking selling home get seller guide today learn process home selling,,thinking selling home get seller guide today learn process home selling,2022-03-17 21:17:11+00:00,Back At You,0,0,0,0,[],[],0.0,0.0,Neutral
1504567485990903813,1373357013636321280,ThraxJax,False,,"https://t.co/3tZSvbASJn 
@ESPNcricinfo 
One more issue is for @LucknowIPL as both their pure International fast bowlers Mark Wood and Chameera are facing fitness issues threatening their bowling department's depth. 

#TATAIPL #IPL2022",issue pure international fast mark wood facing fitness threatening bowling department depth,international fast,issue pure international fast mark wood facing fitness threatening bowling department depth,2022-03-17 21:16:56+00:00,Twitter Web App,0,0,0,0,"['TATAIPL', 'IPL2022']","['ESPNcricinfo', 'LucknowIPL']",0.3666666666666667,0.13809523809523808,Positive
1504567348077998086,1456039993307185164,InningsR,False,,"@Imhp33 @ImJagga_711 @ImPritam264
@ImRo45 @imVkohli @INCINdia @INCRajasthan
@iNUFC_Sy @IS_IPL @its__lew @itsSSR
@itz_me_dbs

For Your Daily Tips ⚽️

 Follow  @panodds &amp; @bets_pls

#88goals .com for daily promotions

➡️ https://t.co/fLi0iAu1PT

#panodds #bettingtipster #88goals https://t.co/M4GwV0YOFc",daily follow daily,daily,daily follow daily,2022-03-17 21:16:23+00:00,Twitter Web App,0,0,0,0,"['88goals', 'panodds', 'bettingtipster', '88goals']","['Imhp33', 'ImJagga_711', 'ImPritam264', 'ImRo45', 'imVkohli', 'INCINdia', 'INCRajasthan', 'iNUFC_Sy', 'IS_IPL', 'its__lew', 'itsSSR', 'itz_me_dbs', 'panodds', 'bets_pls']",0.0,0.0,Neutral
1504566822687100931,1361744537731833856,Walia6Vidhi,False,,@rcb_itcell I still vibe when ever i hear ipl theme song made by sony.,still ever hear theme song made,hear,still ever hear theme song made,2022-03-17 21:14:18+00:00,Twitter for Android,0,0,3,0,[],['rcb_itcell'],0.0,0.0,Neutral
1504566613726617609,6959082,YouTube,True,"San Bruno, CA","SA will take on Bangladesh in a two-match Test series this month without Indian Premier League (IPL)-bound stars in Kagiso Rabada, Lungi Ngidi, Marco Jansen, Rassie van der Dussen and Aiden Markram. https://t.co/LRvN2I6sJq",sa take test series month without premier league lungi marco van,,sa take test series month without premier league lungi marco van,2022-03-17 21:13:28+00:00,Echobox,1,4,5,0,[],[],0.0,0.0,Neutral
1504566534156742656,1302102777393373184,CricCrazyJohns,False,"Kerala, India","Most Centuries In IPL - 
Christopher Henry Gayle-6
Virat Kohli-5
David Warner-4

#IPL2022",henry,,henry,2022-03-17 21:13:09+00:00,Twitter for Android,0,0,0,0,['IPL2022'],[],0.0,0.0,Neutral
1504566509837774863,1468664696173596673,hcflatfangurll,False,,@ThraxJax @InningsR Good for u .. I love all the formats cz they have a flavour of their own .. Test matches have a class of their own ..  just that I feel IPL is a shitty action movie.. would support it only when those arse headed P@kiz say PSL is better than IPL 🤡,good love flavour test class feel action movie would support arse headed say better,good flavour,good love flavour test class feel action movie would support arse headed say better,2022-03-17 21:13:04+00:00,Twitter for iPhone,0,0,0,0,[],"['ThraxJax', 'InningsR', 'kiz']",0.45000000000000007,0.45,Positive
1504566224927146029,951007126595387393,AdmiringGemHC,False,Pakistan🇵🇰,All IPL kid need to read this brilliant piece in @cricbuzz &amp; it's repercussions... https://t.co/rzgCqDsxAo,need read brilliant piece,brilliant,need read brilliant piece,2022-03-17 21:11:56+00:00,Twitter for Android,0,0,0,0,[],['cricbuzz'],1.0,0.9,Positive
1504566163224739864,1494776350556573700,f1jm_,False,Expert Opinions,@Walia6Vidhi Oh I don't know anything but us week RRR bhi release ho rahi hai aur IPL bhi start ho raha hai. So looks tough.   I thought both her films will release after IPL.,oh know anything us week release ho start ho tough thought release,ho tough,oh know anything u week release ho start ho tough thought release,2022-03-17 21:11:41+00:00,Twitter for Android,0,0,0,0,[],['Walia6Vidhi'],0.8333333333333334,-0.3888888888888889,Negative
1504565931950944260,1233483875420180480,Jamshid53544919,False,"India ocupied kashmir,Saringar","IPL 2022: Virat Kohli no longer the aggressive cricketer he used to be, RCB player makes a BIG statement | Cricket News https://t.co/QX4EwJb1UX",longer aggressive cricketer used player big statement cricket news,aggressive big,longer aggressive cricketer used player big statement cricket news,2022-03-17 21:10:46+00:00,WordPress.com,0,0,0,0,[],[],0.1,0.0,Neutral
1504565921502806039,1057286649044844544,ANI,True,India,"Most runs as a captain in IPL history:

🇮🇳Virat Kohli - 4810
🇮🇳Ms Dhoni  - 4475
🇮🇳G. Gambhir - 3518 
🇮🇳Rohit Sharma - 3251 
🇦🇺David Warner -2931",captain history dhoni warner,,captain history dhoni warner,2022-03-17 21:10:43+00:00,Twitter for iPhone,0,0,2,0,[],[],0.0,0.0,Neutral
1504565770285682691,887047795387113472,iamamirofficial,True,"Lahore, Pakistan","IPL #Laserhairremoval -safe enough on face, back, underarms, #bikiniline, legs &amp; arms. Call 609-477-0700. https://t.co/DEB7SbomAp https://t.co/r3h0fZh3al",enough face back arms call,enough,enough face back arm call,2022-03-17 21:10:07+00:00,Postcron App,0,0,0,0,"['Laserhairremoval', 'bikiniline']",[],0.25,0.0,Neutral
1504565465246416898,1337005510382403584,9M_Fisher,True,York,@WeirdlyGripping @cricbuzz 👌👌👌👌 badhiya article... people who are supporting IPL blindly should seriously understand its repurcussions,article people supporting blindly seriously understand,,article people supporting blindly seriously understand,2022-03-17 21:08:55+00:00,Twitter for Android,0,1,1,0,[],"['WeirdlyGripping', 'cricbuzz']",0.4583333333333333,-0.04166666666666666,Negative
1504562666106458123,1487437185603284992,TheCricketPod,False,"London, England",@TheCricketPod You guys got anything special lined up for the IPL?,got anything special lined,special,got anything special lined,2022-03-17 20:57:47+00:00,Twitter for Android,0,0,0,0,[],['TheCricketPod'],0.5714285714285714,0.35714285714285715,Positive
1504562539807457305,951007126595387393,Abhinandan673,False,Himachal Pradesh,"@Abhinandan673 @cricbuzz Elgar's worst fears come true as stars pick IPL over Bangladesh Tests

Click here to view more : https://t.co/bVDUCEoeQS",worst come true pick click view,true,worst come true pick click view,2022-03-17 20:57:17+00:00,Twitter for Android,0,1,1,1,[],"['Abhinandan673', 'cricbuzz']",0.825,-0.325,Negative
1504562409830170647,988067528567115777,cricbuzz,True,,@TheVijayMallya Until you will return money...IPL RCB won't win Trophy 🏆 https://t.co/Mhuecbefbg,return money wo win trophy,,return money wo win trophy,2022-03-17 20:56:46+00:00,Twitter for Android,0,0,0,0,[],['TheVijayMallya'],0.4,0.8,Positive
1504562388133359617,951007126595387393,TheVijayMallya,True,India,"@Abhinandan673 Blkl bhai...
Maine pichhle season perfect prediction kiya tha top 4 ka or bola tha ki MI nhi pahunchegi or CSK will win.. 
Kyuki i know how it works...
Ye bhai Inside edge dekho smjh aa jaega..

Aj @cricbuzz pr ek brilliant article h about IPL &amp; it's effect on world cricket",season perfect prediction tha top ka bola tha mi win know works ye inside edge aa brilliant article effect world cricket,perfect top ye brilliant,season perfect prediction tha top ka bola tha mi win know work ye inside edge aa brilliant article effect world cricket,2022-03-17 20:56:41+00:00,Twitter for Android,0,3,2,0,[],"['Abhinandan673', 'cricbuzz']",0.725,0.7999999999999999,Positive
1504562387948486666,810526895183986689,rcb_itcell,False,,"@rcb_itcell @khadaksingh_ @SonySportsNetwk was the IPL broadcaster till 2018.
Hope they get back the rights next year.
All their theme songs were lit 🔥
https://t.co/ujvnGq4rwC",broadcaster till hope get back theme lit,,broadcaster till hope get back theme lit,2022-03-17 20:56:41+00:00,Twitter for Android,0,0,5,0,[],"['rcb_itcell', 'khadaksingh_', 'SonySportsNetwk']",0.0,0.0,Neutral
1504562217223536645,128893089,khadaksingh_,False,दिलऔर दिमाग,@FarziCricketer IPL and MANGOES,,,,2022-03-17 20:56:00+00:00,Twitter for iPhone,0,0,0,0,[],['FarziCricketer'],0.0,0.0,Neutral
1504562180649205762,1500355552194531331,SonySportsNetwk,True,,@abhira_tanya @AdmiringGemHC https://t.co/ILDqWrJHCQ see this,see,,see,2022-03-17 20:55:51+00:00,Twitter Web App,0,1,1,0,[],"['abhira_tanya', 'AdmiringGemHC']",0.0,0.0,Neutral
1504561688162418698,66326933,FarziCricketer,False,India,"@bhogleharsha I think CSA is at fault here, they could've avoided a clash with IPL with correct scheduling, atleast they owe that much to BCCI who did a full tour at omicron peak",think fault could clash correct owe full tour omicron peak,correct full,think fault could clash correct owe full tour omicron peak,2022-03-17 20:53:54+00:00,Twitter for Android,0,0,2,0,[],['bhogleharsha'],0.55,0.35,Positive
1504561455299018758,1140175423483076613,abhira_tanya,False,,IPL 2022: Here’s who Riyan Parag wants to spend time with as RR – Sports https://t.co/wgaqXLOCNW,spend time sports,spend,spend time sport,2022-03-17 20:52:59+00:00,WordPress.com,0,0,0,0,[],[],0.0,0.0,Neutral
1504561193041678337,44632954,AdmiringGemHC,False,Pakistan🇵🇰,BCCI expected to issue tender for IPL rights next week: https://t.co/ZXCQhz4fDg,issue tender week,,issue tender week,2022-03-17 20:51:56+00:00,Hootsuite Inc.,0,0,1,0,[],[],0.0,0.0,Neutral
1504561127790940160,1237132893664600064,bhogleharsha,True,"Mumbai, India",Thinking about selling your home? Get your seller guide today and learn about the process of home selling! https://t.co/aYYDe494Ow https://t.co/a4XxEp8ddT,thinking selling home get seller guide today learn process home selling,,thinking selling home get seller guide today learn process home selling,2022-03-17 20:51:40+00:00,Back At You,0,0,0,0,[],[],0.0,0.0,Neutral
1504560974623346691,1263898793012916224,Kim__Era2,False,#KDice #ShiVi ,"Mumbai Indians 'welcome home' rival IPL franchises The vibrant city of Mumbai and its five-time champions IPL outfit Mumbai Indians have splashed in a hue of colours covering the city, in welcoming the fellow nine franchi... #Sports by #TimesofIndia https://t.co/j13noc9IDw",home rival vibrant city outfit splashed hue covering city welcoming fellow sports,vibrant hue fellow,home rival vibrant city outfit splashed hue covering city welcoming fellow sport,2022-03-17 20:51:04+00:00,MarketsCafe,0,0,0,0,"['Sports', 'TimesofIndia']",[],0.3333333333333333,0.16666666666666666,Positive
1504560944445210634,1437829851604393986,liaml4893,True,Manchester/Barrow-in-Furness,@Kim__Era2 Kim ❤️❤️ ShiVi is not going anywhere! Star Plus knows that Pandya Store has the potential plus this show is famous! They will not get any other show to replace it any time soon with same TRP! Plus IPL season is coming so they will definitely not take the risk of ending the show❤️,kim going anywhere star plus store potential plus show famous get show replace time soon plus season coming definitely take risk ending,star store potential famous show,kim going anywhere star plus store potential plus show famous get show replace time soon plus season coming definitely take risk ending,2022-03-17 20:50:57+00:00,Twitter for iPhone,0,0,1,0,[],['Kim__Era2'],0.8333333333333334,0.16666666666666666,Positive
1504560918331543557,1101252730205683712,amolrajan,True,London,@liaml4893 Just with the ipl bound that that will bowl slow and wide on outside of off - practising switch hit like Maxi reverse sweep will score lots of runs - sure you know this,bound bowl slow wide outside switch hit like reverse sweep score lots sure know,slow wide reverse lots,bound bowl slow wide outside switch hit like reverse sweep score lot sure know,2022-03-17 20:50:50+00:00,Twitter Web App,0,0,0,0,[],['liaml4893'],0.43472222222222223,0.024999999999999994,Positive
1504560748906827777,1496036290181144578,ImRaina,True,India,"They can't play🙄 
///#PAKvAUS  #IPL https://t.co/DSE5lZIrlO",ca,,ca,2022-03-17 20:50:10+00:00,Twitter for Android,0,0,2,0,"['PAKvAUS', 'IPL']",[],0.0,0.0,Neutral
1504560720868147203,1263898793012916224,balkadi,True,Kingdom of Saudi Arabia,"A stress free Kohli could be dangerous news for opposition: Maxwell Kohli, who relinquished RCB captaincy after last year's IPL, has also resigned from T20 and Test captaincy while being removed from ODI leadership role #Latest News by #BusinessStandard https://t.co/I9xqwOkA8h",stress free could dangerous news opposition maxwell captaincy last also resigned test captaincy removed leadership role latest news,free last,stress free could dangerous news opposition maxwell captaincy last also resigned test captaincy removed leadership role latest news,2022-03-17 20:50:03+00:00,MarketsCafe,0,0,0,0,"['Latest', 'BusinessStandard']",[],0.6666666666666667,0.07500000000000001,Positive
1504560717814538244,858339416636522496,ICC,True,Dubai,@bhogleharsha I don’t think so.I think it’s make IPL better,think think make better,,think think make better,2022-03-17 20:50:03+00:00,Twitter for iPhone,0,0,0,0,[],['bhogleharsha'],0.5,0.5,Positive
1504560687170924550,973385868202389504,IPL,True,"Mumbai, India","IPL 2022-‘Everyone Was Laughing at Them, but They Went Onto Win IPL’ https://t.co/DaUEpRsplW",everyone laughing went onto win,,everyone laughing went onto win,2022-03-17 20:49:55+00:00,WordPress.com,0,0,0,0,[],[],0.4,0.8,Positive
1504560612080246793,1022877839438348291,OfficialPSL,True,South Africa,"@amolrajan Evening Amol - regarding spin bowlers, I've just seen one of those ""Top 5"" Youtube videos, in this case, strange bowling actions.  There was a guy who played in the IPL in 2016 whose action was almost identical to Paul Adams!",evening regarding spin seen top case strange bowling guy whose action almost identical,top strange identical,evening regarding spin seen top case strange bowling guy whose action almost identical,2022-03-17 20:49:37+00:00,Twitter Web App,0,0,0,0,[],['amolrajan'],0.25,0.18333333333333335,Positive
1504560494409314304,777457967989862400,TheRealPCBMedia,True,"Lahore, Pakistan",@ImRaina @balkadi Gonna miss you in ipl 🥺🥺🥺🥺,gon na miss,,gon na miss,2022-03-17 20:49:09+00:00,Twitter for Android,0,0,0,0,[],"['ImRaina', 'balkadi']",0.0,0.0,Neutral
1504560197636968461,1473692406327529478,_cricingif,True,,isn't it enough to ban cricket in india for some time? how foreginers are feeling their self save their now? or all the threaten are in Pakistan? ICC means international cricket council or indian cricket council?? @ICC @IPL @OfficialPSL @TheRealPCBMedia  @_cricingif https://t.co/fmSlCesERe,enough ban cricket time feeling self save threaten international cricket council cricket council,enough international,enough ban cricket time feeling self save threaten international cricket council cricket council,2022-03-17 20:47:59+00:00,Twitter for Android,0,0,0,0,[],"['ICC', 'IPL', 'OfficialPSL', 'TheRealPCBMedia', '_cricingif']",0.25,0.0,Neutral
1504560097669918722,1140175423483076613,newstalkzbsport,False,New Zealand,NCA’s Hardik Pandya Bowles Passes Yo-Yo Test with Honor in Preparing for IPL: Report – Sports https://t.co/h1x746Txgo,test honor report sports,,test honor report sport,2022-03-17 20:47:35+00:00,WordPress.com,0,0,0,0,[],[],0.0,0.0,Neutral
1504559450455445505,1065367905712300032,critcalthinkr,False,,"@newstalkzbsport 2 terrible home summers, players playing ipl over NZ
NZC choosing spark over sky

Has any sports organisation done more harm to themselves than NZC right now?",terrible home choosing spark sky sports done harm right,terrible spark sky,terrible home choosing spark sky sport done harm right,2022-03-17 20:45:01+00:00,Twitter for Android,0,0,0,0,[],['newstalkzbsport'],0.7678571428571428,-0.35714285714285715,Negative
1504559386026520580,432053099,murtazaatif7,False,,"@bhogleharsha IPL has become way too long to sustain interest - globally for sure, it might dip in India as well in the next few years. Less is better in most cases.",become way long sustain interest globally sure might dip well less better,long sustain sure,become way long sustain interest globally sure might dip well le better,2022-03-17 20:44:45+00:00,Twitter for iPhone,0,1,2,1,[],['bhogleharsha'],0.5962962962962962,0.31666666666666665,Positive
1504559167197310976,368138528,MokhtiarAli,False,United States,@critcalthinkr @murtazaatif7 @MokhtiarAli But they exhausted before world cup just bcoz of ipl they should hv rest for big tornament,exhausted world cup rest big,big,exhausted world cup rest big,2022-03-17 20:43:53+00:00,Twitter for Android,0,0,1,0,[],"['critcalthinkr', 'murtazaatif7', 'MokhtiarAli']",0.39999999999999997,-0.2,Negative
1504559134490116096,1438363310672396291,hcflatfangurll,False,,"There was a time when IPL used to feel like a festival :)
Do you still feel the same way now? or something is missing? #IPL2022 #IPL #TATAIPL #TATAIPL2022",time used feel like festival still feel way something missing,,time used feel like festival still feel way something missing,2022-03-17 20:43:45+00:00,Twitter Web App,0,0,1,0,"['IPL2022', 'IPL', 'TATAIPL', 'TATAIPL2022']",[],0.05,-0.2,Negative
1504558791068721158,1190242305409736705,ESPNcricinfo,True,"At the cricket, mainly",@hcflatfangurll @AdmiringGemHC We have to wait till end of may bc IPL will end on 22nd May,wait till end may end may,till,wait till end may end may,2022-03-17 20:42:23+00:00,Twitter for iPhone,0,1,0,0,[],"['hcflatfangurll', 'AdmiringGemHC']",0.0,0.0,Neutral
1504558546549190657,1140175423483076613,kevin_ABD17,False,"Chennai, India",‘Mayank Agarwal will be a great captain’: Shikhar Dhawan on NDTV ahead of IPL 2022 – Sports https://t.co/oR6N37jA2s,agarwal great captain ahead sports,great,agarwal great captain ahead sport,2022-03-17 20:41:25+00:00,WordPress.com,0,0,0,0,[],[],0.75,0.8,Positive
1504558496888598528,332754235,ABdeVilliers17,True,"South Africa, Pretoria",@ESPNcricinfo I think only South African player dont respecting their Country very bad and Greedy players #IPL,think south player dont respecting country bad greedy,bad,think south player dont respecting country bad greedy,2022-03-17 20:41:13+00:00,Twitter for iPhone,0,0,0,0,['IPL'],['ESPNcricinfo'],0.6666666666666666,-0.6999999999999998,Negative
1504558473828257800,1201988893911986178,imVkohli,True,,"Thinking about selling your home? Get your seller guide today and learn about the process of home selling!

Steve Mizz
RE/MAX TITANIUM
352-874-6638
An Award Winning Real Estate Company
Not happy with your Brokerage? Check us... https://t.co/RvzvEAc6ZN https://t.co/aWfR1y6YZc",thinking selling home get seller guide today learn process home selling titanium award winning real estate company happy brokerage check us,real happy,thinking selling home get seller guide today learn process home selling titanium award winning real estate company happy brokerage check u,2022-03-17 20:41:08+00:00,Back At You,0,0,0,0,[],[],0.6833333333333332,0.5,Positive
1504558429561671680,1443488335138201600,RealMtheekshana,False,Sri Lanka,"The color of IPL in Mumbai, welcome to MI’s opponents, special message for each team https://t.co/GsKAlGcJ5F",color welcome mi special message team,special,color welcome mi special message team,2022-03-17 20:40:57+00:00,WordPress.com,0,0,0,0,[],[],0.7357142857142858,0.5785714285714286,Positive
1504558136371597313,1302102777393373184,ChennaiIPL,True,"Chepauk, Chennai","Mark Wood likely to be ruled out of IPL 2022. If he is ruled out Lucknow are expected to rope in Kane Richardson as replacement pick. 

Mark Wood will have time till March 24th to confirm about his availability to the franchise

#IPL2022 #LSG",mark wood likely rope replacement pick mark wood time till march th confirm availability franchise,likely,mark wood likely rope replacement pick mark wood time till march th confirm availability franchise,2022-03-17 20:39:47+00:00,Twitter for Android,0,0,0,0,"['IPL2022', 'LSG']",[],1.0,0.0,Neutral
1504557969366736902,1091754599810285571,msdhoni,True,India,https://t.co/ay2x40QaxE | Bavuma acknowledges IPL catch-22 is tricky for all involved Proteas limited-overs captain Temba Bavuma said it wasn't an ideal situation not to have your best players available for a series because of the Indian Premier League. https://t.co/HljaugaDHQ,tricky involved captain said ideal situation best available series premier league,tricky ideal available,tricky involved captain said ideal situation best available series premier league,2022-03-17 20:39:07+00:00,IFTTT,0,0,0,0,[],[],0.5666666666666668,0.7666666666666666,Positive
1504557877599604736,1481456369253462026,daniel86cricket,True,Sri Lanka,Thinking about selling your home? Get your seller guide today and learn about the process of home selling! https://t.co/QpQSNuux3h https://t.co/A8ACyMYXrj,thinking selling home get seller guide today learn process home selling,,thinking selling home get seller guide today learn process home selling,2022-03-17 20:38:46+00:00,Back At You,0,0,0,0,[],[],0.0,0.0,Neutral
1504557767268483074,1501479336875937794,imtheguy007,False,"London, England",@kevin_ABD17 @ABdeVilliers17 @imVkohli Miss you ABD in this  IPL,miss,,miss,2022-03-17 20:38:19+00:00,Twitter for Android,0,0,1,0,[],"['kevin_ABD17', 'ABdeVilliers17', 'imVkohli']",0.0,0.0,Neutral
1504557255248658451,1188319183752200193,singhhemant0106,False,,@RealMtheekshana @ChennaiIPL @msdhoni @IPL All d best 💛,best,,best,2022-03-17 20:36:17+00:00,Twitter for iPhone,0,0,0,0,[],"['RealMtheekshana', 'ChennaiIPL', 'msdhoni', 'IPL']",0.3,1.0,Positive
1504557238031196168,25074116,GorgeousGryffin,False,Raipur,"Thinking about selling your home? Get your seller guide today and learn about the process of home selling!

Teresa Kennedy 
281-799-3927 https://t.co/g3vyjmyCy1 https://t.co/wtfW3iQpaR",thinking selling home get seller guide today learn process home selling,,thinking selling home get seller guide today learn process home selling,2022-03-17 20:36:13+00:00,Back At You,0,0,0,0,[],[],0.0,0.0,Neutral
1504557010037063694,1332180446,CaptainMat5,False,,"@bhogleharsha Is this the right approach?We all say priotising International cricket bt when it comes to IPL we all gladly accept players ignorance towards national https://t.co/9XPnMdo2ki we accept if our players preferred any league over country,IPL is ruining international cricket by power",right approach say international cricket comes gladly accept ignorance towards national accept preferred league country international cricket power,right international accept national preferred league international,right approach say international cricket come gladly accept ignorance towards national accept preferred league country international cricket power,2022-03-17 20:35:19+00:00,Twitter Web App,0,0,0,0,[],['bhogleharsha'],0.3839285714285714,0.19642857142857142,Positive
1504556672496254988,2489997481,mufaddal_vohra,False,,@bhogleharsha IPL is to cricketers worldwide... What onsite opportunity is to an IT employees. Make hay while the sun shines.,opportunity make hay sun,,opportunity make hay sun,2022-03-17 20:33:58+00:00,Twitter for Android,0,0,0,0,[],['bhogleharsha'],0.0,0.0,Neutral
1504556431198277632,2568118123,bongars27,False,,"And is it fair? NZ cricketers can go there to play IPL, a private league mingling with thousands of people",fair go play private league people,private,fair go play private league people,2022-03-17 20:33:01+00:00,Twitter for Android,0,1,0,0,[],[],0.6375,0.35,Positive
