tweet_id,author_id,tweet_by,tweet_by_verified,user_location,text,clean_tweet,adjectives,sentiment_text,created_at,source,retweets,replies,likes,quote_count,hastags,mentions,subjectivity,polarity,sentiment
1504555854967750656,1405491713884499968,Mr_Kaka0,False,5th Floor Serena Hotel Kabul,"@daniel86cricket @imtheguy007 Clown smoking something really good. Totally forgot IPL came in 2008 &amp; PSL in 2015. PCB was running on BCCI funds &amp; even after 7 years ..coming up with actual “duplicate” league still running on BCCI funds &amp; it’s not me, it’s their own chairman who said it",clown smoking something really good totally forgot came running funds even coming actual duplicate league still running funds chairman said,clown good forgot actual,clown smoking something really good totally forgot came running fund even coming actual duplicate league still running fund chairman said,2022-03-17 20:30:43+00:00,Twitter for iPhone,0,0,14,0,[],"['daniel86cricket', 'imtheguy007']",0.4833333333333334,0.2333333333333333,Positive
1504555705990275077,1397261763498807299,kiaraaitis,False,,"England have declared at 507/9. A marvelous batting efforts from Joe Root and Ben Stokes to take England to a massive total, Lawrence also played well for his 91. 

#tendulkar #indvssa #slogover #didyouknow #rohitsharma #klrahul #ipl #sachin #cricketmerijaan #tendulkar",declared marvelous batting joe root ben take massive total also well,marvelous massive,declared marvelous batting joe root ben take massive total also well,2022-03-17 20:30:08+00:00,Twitter,1,0,0,0,"['tendulkar', 'indvssa', 'slogover', 'didyouknow', 'rohitsharma', 'klrahul', 'ipl', 'sachin', 'cricketmerijaan', 'tendulkar']",[],0.9166666666666666,0.3333333333333333,Positive
1504555595919237134,71594919,alishaesthetic,False,,CRICKET: SA players choose IPL over Bangladesh Tests but Proteas at full strength for ODIs https://t.co/SbUNr2salF,cricket sa choose full strength,full,cricket sa choose full strength,2022-03-17 20:29:42+00:00,Echobox,2,0,1,0,[],[],0.55,0.35,Positive
1504555444395819017,958577883928317952,Cricketracker,True,India,@singhhemant0106 @bhogleharsha I love India and Indian people probably more than you love yourself. I don't need your certificate to show my feelings. Go and check my first reply to Harsha . I talked about the impact of IPL and franchise cricket on the international cricket.,love people probably love need certificate show go check first reply impact franchise cricket international cricket,impact international,love people probably love need certificate show go check first reply impact franchise cricket international cricket,2022-03-17 20:29:05+00:00,Twitter for Android,0,0,0,0,[],"['singhhemant0106', 'bhogleharsha']",0.3833333333333333,0.3125,Positive
1504555379237298186,243563320,DhadwalParanjay,False,,@bhogleharsha Plus player like Jansen van de dussen and ngidi r not 1st choices . They going to warm the bench .. they should have stayed .. ipl is killing international n South African cricket,plus player like van de st going warm bench stayed killing international south cricket,warm international,plus player like van de st going warm bench stayed killing international south cricket,2022-03-17 20:28:50+00:00,Twitter for Android,0,0,0,0,[],['bhogleharsha'],0.3,0.3,Positive
1504555043869331456,1259157039407747072,BrahmanAbhishe7,False,,@GorgeousGryffin @CaptainMat5 @mufaddal_vohra @bongars27 He’s better than a majority of indian pacers of other teams in this ipl and he is our third pacer. But i get what you mean. But personally i am confident he and our bowling attack will do really well. They’ll make a huge difference.,better majority third pacer get mean personally confident bowling attack really well make huge difference,third confident huge,better majority third pacer get mean personally confident bowling attack really well make huge difference,2022-03-17 20:27:30+00:00,Twitter for iPhone,0,1,1,0,[],"['GorgeousGryffin', 'CaptainMat5', 'mufaddal_vohra', 'bongars27']",0.5201388888888889,0.21458333333333335,Positive
1504554996741943298,1435359469567819780,mipaltan,True,"Mumbai, India",@ESPNcricinfo South African Cricket Distroyed Via IPL.,south cricket via,south,south cricket via,2022-03-17 20:27:19+00:00,Twitter for Android,0,1,0,0,[],['ESPNcricinfo'],0.0,0.0,Neutral
1504554578452234242,1948875368,ImRo45,True,,Just got this offer Health and Beauty IPL (Intense Pulsed Light) Hair Removal https://t.co/j3mtCtr64m,got offer health beauty intense light hair removal,intense light,got offer health beauty intense light hair removal,2022-03-17 20:25:39+00:00,twittbot.net,0,0,1,0,[],[],0.85,0.30000000000000004,Positive
1504554500236922881,243563320,rilla_2004,False,"Kolkata, India","@bhogleharsha This is pathetic.  Ipl ruining cricket ... South Africa well placed in the test championship . This will benefit India if South Africa don't win 

Ruling must be country b4 worthless ipl",pathetic cricket south well test championship benefit south win ruling must country worthless,pathetic south win,pathetic cricket south well test championship benefit south win ruling must country worthless,2022-03-17 20:25:20+00:00,Twitter for Android,0,0,0,0,[],['bhogleharsha'],0.7666666666666666,-0.3333333333333333,Negative
1504553887965097988,1140175423483076613,KKRiders,True,Kolkata,"With two of the best spinners in the IPL and a competent roster, Kumar Sangakkara is confident of success – Sports https://t.co/rKpZC2WyfN",best competent roster confident success sports,confident,best competent roster confident success sport,2022-03-17 20:22:54+00:00,WordPress.com,0,0,0,0,[],[],0.44999999999999996,0.575,Positive
1504553885637226502,1140175423483076613,MeghaChavan17,False,"Maharashtra, India",IPL 2022: Here’s what Hardika Pandya’s leadership motto would be for the titans of Gujarat – Sports https://t.co/NMYc5RGfUP,leadership motto would sports,,leadership motto would sport,2022-03-17 20:22:54+00:00,WordPress.com,0,0,0,0,[],[],0.0,0.0,Neutral
1504553368047562760,1470724238466236422,iplmediarights,False,,Delhi Capitals bus attacked in Mumbai #IPL #DelhiCapitals https://t.co/fklzxpEvuo,bus,,bus,2022-03-17 20:20:50+00:00,Twitter for iPhone,2,5,5,0,"['IPL', 'DelhiCapitals']",[],0.0,0.0,Neutral
1504553329040375811,1282005691821985793,smileandraja,False,India,"@Mr_Kaka0 @bhogleharsha Ok sir, i will convey the message to CSA to send their players to play in world's richest premium branded league PSL instead of going for poor league IPL where hardly any active cricketers play. Regards 👍🏼",sir convey message send play world premium branded league instead going poor league hardly active play,convey poor active,sir convey message send play world premium branded league instead going poor league hardly active play,2022-03-17 20:20:41+00:00,Twitter for Android,0,1,1,0,[],"['Mr_Kaka0', 'bhogleharsha']",0.6,-0.26666666666666666,Negative
1504553309268758528,1408089740268630023,Anshu34503604,False,,@kiaraaitis unfollow me during ipl babe 😂😂😭😭,babe,,babe,2022-03-17 20:20:36+00:00,Twitter Web App,0,0,0,0,[],['kiaraaitis'],0.0,0.0,Neutral
1504553205509808129,1042942180824772608,TheBarmyArmy,True,All over the world.,"Thinking about selling your home? Get your seller guide today and learn about the process of home selling!

Andrea Osbon
Churchill Properties
Residential Realtor
508-228-3733 https://t.co/0MOLODromM https://t.co/Mc0uwDch3D",thinking selling home get seller guide today learn process home selling residential realtor,residential,thinking selling home get seller guide today learn process home selling residential realtor,2022-03-17 20:20:12+00:00,Back At You,0,0,0,0,[],[],0.0,0.0,Neutral
1504553187864297481,1394054760358027265,ShubhamRetweets,False,India,Lescolton 3in1 700000 Pulsed IPL Laser Hair Removal Device Permanent Hair Remova https://t.co/E49PKXTn8m eBay https://t.co/WaVsItsUDf,laser hair removal device permanent hair,removal,laser hair removal device permanent hair,2022-03-17 20:20:07+00:00,dlvr.it,0,0,0,0,[],[],0.0,0.0,Neutral
1504552923459915776,1500355552194531331,Oliver79533583,False,,@abhira_tanya @AdmiringGemHC May.. after IPL ig,may,,may,2022-03-17 20:19:04+00:00,Twitter Web App,0,1,1,0,[],"['abhira_tanya', 'AdmiringGemHC']",0.0,0.0,Neutral
1504552676016603155,1475168021203361799,nissoana_iqbal,False,"Lahore, Pakistan",@alishaesthetic united haar gayi ab ipl me kya hi maza 😭😭😭,united hi maza,united,united hi maza,2022-03-17 20:18:05+00:00,Twitter for Android,0,0,0,0,[],['alishaesthetic'],0.0,0.0,Neutral
1504552614758858752,1067563741234020352,CricketinHeroes,False,,NO PROBLEM BUT IPL STILL TAKE THEIR KNEES https://t.co/qkGBJGgkpa,problem still take,,problem still take,2022-03-17 20:17:51+00:00,Twitter for Android,0,0,0,1,[],[],0.0,0.0,Neutral
1504552415298666504,1315644636493344769,rashidkhan_19,True,Afghanistan,"@Cricketracker Raina is called Mr IPL. Everyone was thinking we’d call King Kohli Mr IPL but Raina has that nickname but he’s way past his prime &amp; unsold in auction this time. Time to give the Mr IPL tag to someone else I guess.

That someone else is……..Reply who u think it should be",everyone thinking call king nickname way past prime unsold auction time time give tag someone else guess someone else reply think,nickname prime unsold,everyone thinking call king nickname way past prime unsold auction time time give tag someone else guess someone else reply think,2022-03-17 20:17:03+00:00,Twitter for iPad,0,1,0,0,[],['Cricketracker'],0.25,-0.25,Negative
1504552322084786176,1408089740268630023,Uz_Khawaja,True,"Brisbane, Queensland","@DhadwalParanjay then during ipl stay away from my twts, achha nai lagega 😭",stay away,,stay away,2022-03-17 20:16:41+00:00,Twitter Web App,0,2,0,0,[],['DhadwalParanjay'],0.0,0.0,Neutral
1504552280967860225,1501479336875937794,babarazam258,True,,@BrahmanAbhishe7 @mipaltan @ImRo45 Mi is going win the IPL CHAMPION,mi going win champion,win,mi going win champion,2022-03-17 20:16:31+00:00,Twitter for Android,0,0,1,0,[],"['BrahmanAbhishe7', 'mipaltan', 'ImRo45']",0.4,0.8,Positive
1504552095931932679,35739920,imabd28,True,"Sialkot, Pakistan","Thinking about selling your home? Get your seller guide today and learn about the process of home selling!

Susan BeVille
The Susan BeVille Team
 
Sellstate Superior Realty
Serving The Villages and Ocala/Marion County in... https://t.co/FVm798YzkW https://t.co/zvd9aEUQPj",thinking selling home get seller guide today learn process home selling team superior realty serving county,,thinking selling home get seller guide today learn process home selling team superior realty serving county,2022-03-17 20:15:47+00:00,Back At You,0,0,0,0,[],[],0.9,0.7,Positive
1504551950099968000,880031916019171328,iMRizwanPak,True,Pakistan,"@rilla_2004 If @KKRiders will go with this it will be the best jersey ever of ipl...
Great work 👍👏",go best jersey ever great work,great,go best jersey ever great work,2022-03-17 20:15:12+00:00,Twitter for Android,0,1,3,0,[],"['rilla_2004', 'KKRiders']",0.525,0.9,Positive
1504551880126795776,3099473820,TheRealPCB,True,,"Okay paring the p*rn comment let’s bring some more classy acts from classy family - IPL betting in 3015 for which he got lifetime ban from series, property scam ,spa scam real estate scandal too classy for us I am way better as kk fans than such classy people https://t.co/IN872ADbD4",paring comment let bring classy classy family betting got lifetime ban series property scam spa scam real estate scandal classy us way better classy people,classy classy lifetime ban scam scam real classy,paring comment let bring classy classy family betting got lifetime ban series property scam spa scam real estate scandal classy u way better classy people,2022-03-17 20:14:56+00:00,Twitter for iPhone,0,1,0,1,[],[],0.7333333333333334,0.18333333333333335,Positive
1504551825176940544,1470724238466236422,FirdoseM,True,,"IPL Franchise Delhi Capitals team bus has been attached by group of people

 #IPL #DelhiCapitals #Attack",franchise team bus attached group people attack,,franchise team bus attached group people attack,2022-03-17 20:14:43+00:00,Twitter for iPhone,2,3,3,1,"['IPL', 'DelhiCapitals', 'Attack']",[],0.0,0.0,Neutral
1504551649288896514,16542390,CityOrdinary,False,hyderabad,"✅ Khaya Zondo 
✅ Lizaad Williams
❌ IPL-bound players 

https://t.co/T7CF65hgIc",,,,2022-03-17 20:14:01+00:00,Sprinklr,2,6,95,0,[],[],0.0,0.0,Neutral
